<?xml version="1.0" encoding="UTF-8"?>
<!DOCTYPE device PUBLIC "-//bengt-martensson.de//devices//en"
 "../dtds/devices.dtd">
<device id="canon" name="Canon EOS 450D" model="EOS-450D" type="camera">
    <description>Canon EOS 450D, and probably a lot of other Canon models.</description>
    <comment>References: http://www.doc-diy.net/photo/rc-1_hacked/</comment>
  <commandset type="ir" remotename="canon" protocol="raw_ccf">
    <command cmdref="trigger">
      <ccf>0000 007e 0002 0000 0010 00f0 0010 00f0</ccf>
    </command>
    <command cmdref="delayed_trigger">
      <ccf>0000 007e 0002 0000 0010 00af 0010 00af</ccf>
    </command>
  </commandset>
</device>
