<?xml version="1.0" encoding="UTF-8"?>
<!DOCTYPE device PUBLIC "-//bengt-martensson.de//devices//en"
 "../dtds/devices.dtd">
<!-- Status: tested(??) -->
<device id="denon_asd_3n" name="Denon iPod dock" vendor="Denon" model="asd_3n" type="misc_audio">
  <commandset type="ir" protocol="denon_k" deviceno="2" subdevice="3" remotename="denon_asd_3n" original_remote="Denon RC-1088">
    <command cmdref="browse_remote" name="browse/remote"	cmdno="45"/>
    <command cmdref="power_toggle"	name="power"		cmdno="71"/>
    <command cmdref="previous"				cmdno="5"/>
    <command cmdref="play_pause"	name="play/pause"	cmdno="1"/>
    <command cmdref="next"					cmdno="4"/>
    <command cmdref="title"		name="top"		cmdno="23"/>
    <command cmdref="favorites" name="favorites/all music"	cmdno="72"/>
    <command cmdref="right"					cmdno="28"/>
    <command cmdref="left"					cmdno="27"/>
    <command cmdref="up"					cmdno="25"/>
    <command cmdref="down"					cmdno="26"/>
    <command cmdref="ok"					cmdno="24"/>
    <command cmdref="radio_mode"	name="internet radio"	cmdno="75"/>
    <command cmdref="ipod_mode"	name="iPod"		cmdno="76"/>
    <command cmdref="shuffle"	name="random"		cmdno="16"/>
    <command cmdref="repeat"				cmdno="17"/>
    <command cmdref="memory"				cmdno="80"/>
    <command cmdref="mute_toggle"	name="mute"		cmdno="77"/>
    <command cmdref="volume_up"				cmdno="2"/>
    <command cmdref="volume_down"				cmdno="3"/>
    <command cmdref="page_down"				cmdno="73"/>
    <command cmdref="page_up"				cmdno="74"/>

    <command cmdref="stop"					cmdno="8"/>
<!--
    <command cmdref="search_plus"				cmdno="21"/>
    <command cmdref="search_plus"				cmdno="22"/>
    <command cmdref="search_plus"				cmdno="31"/>
    <command cmdref="page_search"				cmdno="34"/>
-->
    <command cmdref="cmd_return"				cmdno="35"/>
    <command cmdref="browse_mode"				cmdno="46"/>
    <command cmdref="remote_mode"				cmdno="47"/>
    <command cmdref="shuffle_songs"				cmdno="64"/>
    <command cmdref="shuffle_albums"			cmdno="65"/>
    <command cmdref="shuffle_off"				cmdno="66"/>
    <command cmdref="repeat_one"				cmdno="67"/>
    <command cmdref="repeat_all"				cmdno="68"/>
    <command cmdref="repeat_off"				cmdno="69"/>
  </commandset>
</device>
