<?xml version="1.0" encoding="UTF-8"?>
<!DOCTYPE device PUBLIC "-//bengt-martensson.de//devices//en"
"../dtds/devices.dtd">
<device id="avcontrol5" name="AVControl 5" vendor="Vicanco" model="avc5" type="misc_audio">
  <commandset type="ir" protocol="recs80" toggle="yes" deviceno="5" remotename="avcontrol5">
    <command cmdref="in_tv"		cmdno="13"/>
    <command cmdref="in_vcr"		cmdno="1"/>
    <command cmdref="in_dvd"		cmdno="3"/>
    <command cmdref="in_sat"		cmdno="7"/>
    <command cmdref="in_dvb_t"		cmdno="2"/>
    <command cmdref="in_aux"		cmdno="9"/>
    <command cmdref="lock_input"	cmdno="10"/>
  </commandset>
</device>
