<?xml version="1.0" encoding="UTF-8"?>
<!DOCTYPE device PUBLIC "-//bengt-martensson.de//devices//en" "../dtds/devices.dtd">
<device id="cyberhome-ch_dvd_402" name="Cyberhome DVD 402" vendor="Cyberhome" model="402" type="dvd">
  <commandset type="ir" protocol="nec1" toggle="no" deviceno="114" subdevice="205" remotename="cyberhome_dvd_402">
    <command cmdref="cmd_power_toggle" 	cmdno="14"/>
    <command cmdref="cmd_open_close" 	cmdno="26"/>
    <command cmdref="cmd_title" 	cmdno="64"/>
    <command cmdref="cmd_menu" 		cmdno="2"/>
    <command cmdref="cmd_setup" 	cmdno="65"/>
    <command cmdref="cmd_display" 	cmdno="80"/>
    <command cmdref="cmd_audio" 	cmdno="22"/>
    <command cmdref="cmd_angle" 	cmdno="84"/>
    <command cmdref="cmd_mute_toggle" 	cmdno="7"/>
    <command cmdref="cmd_goto"	 	cmdno="18"/>
    <command cmdref="cmd_subtitle" 	cmdno="88"/>

    <command cmdref="cmd_up" 		cmdno="68"/>
    <command cmdref="cmd_down" 		cmdno="29"/>
    <command cmdref="cmd_left" 		cmdno="28"/>
    <command cmdref="cmd_right" 	cmdno="72"/>
    <command cmdref="cmd_ok" 		cmdno="92"/>

    <command cmdref="cmd_rewind" 	cmdno="31"/>
    <command cmdref="cmd_fast_forward" 	cmdno="93"/>
    <command cmdref="cmd_play" 		cmdno="6"/>
    <command cmdref="cmd_previous" 	cmdno="24"/>
    <command cmdref="cmd_next" 		cmdno="25"/>
    <command cmdref="cmd_pause_toggle"	cmdno="89"/>
    <command cmdref="cmd_still_advance" cmdno="27"/>
    <command cmdref="cmd_stop" 		cmdno="30"/>

    <command cmdref="cmd_0" 		cmdno="73"/>
    <command cmdref="cmd_1" 		cmdno="19"/>
    <command cmdref="cmd_2" 		cmdno="16"/>
    <command cmdref="cmd_3" 		cmdno="17"/>
    <command cmdref="cmd_4" 		cmdno="15"/>
    <command cmdref="cmd_5" 		cmdno="12"/>
    <command cmdref="cmd_6" 		cmdno="13"/>
    <command cmdref="cmd_7" 		cmdno="11"/>
    <command cmdref="cmd_8" 		cmdno="8"/>
    <command cmdref="cmd_9" 		cmdno="9"/>
    <command cmdref="cmd_plus10"	cmdno="77"/>
    <command cmdref="cmd_clear" 	cmdno="81"/>

    <command cmdref="cmd_program"	cmdno="21"/>
    <command cmdref="cmd_repeat" 	cmdno="3"/>
    <command cmdref="cmd_a_b" 		cmdno="4"/>
    <command cmdref="cmd_intro"		cmdno="69"/>
    <command cmdref="cmd_zoom" 		cmdno="23"/>
    <command cmdref="cmd_effect_toggle"	cmdno="5"/>
    <command cmdref="cmd_marker" 	cmdno="85"/>
    <command cmdref="cmd_return" 	cmdno="10"/>
  </commandset>
</device>