<?xml version="1.0" encoding="UTF-8"?>
<!DOCTYPE device PUBLIC "-//bengt-martensson.de//devices//en"
 "../dtds/devices.dtd">
<device id="philips_vr1100" name="Philips VCR VR1100" vendor="Philips" model="VR1100" type="vcr">
  <jp1data>
    <setupcode value="1234"/>
  </jp1data>
  <commandset type="ir" protocol="rc5" toggle="yes" deviceno="5" remotename="philips_vr1100">
    <command cmdref="cmd_0" 				cmdno="0"/>
    <command cmdref="cmd_1" 				cmdno="1"/>
    <command cmdref="cmd_2" 				cmdno="2"/>
    <command cmdref="cmd_3" 				cmdno="3"/>
    <command cmdref="cmd_4" 				cmdno="4"/>
    <command cmdref="cmd_5" 				cmdno="5"/>
    <command cmdref="cmd_6" 				cmdno="6"/>
    <command cmdref="cmd_7" 				cmdno="7"/>
    <command cmdref="cmd_8" 				cmdno="8"/>
    <command cmdref="cmd_9" 				cmdno="9"/>
    <command cmdref="cmd_power_toggle" name="power"	cmdno="12"/>
    <command cmdref="cmd_in_tv"				cmdno="63"/>
    <command cmdref="cmd_vcr_tv" 			cmdno="62"/>
    <command cmdref="cmd_previous" 			cmdno="37"/>
    <command cmdref="cmd_next" 				cmdno="38"/>
    <command cmdref="cmd_still_advance" 		cmdno="41"/>
    <command cmdref="cmd_open" 				cmdno="45"/>
    <command cmdref="cmd_clear" 			cmdno="49"/>
    <command cmdref="cmd_play" 				cmdno="53"/>
    <command cmdref="cmd_rewind" 			cmdno="50"/>
    <command cmdref="cmd_fast_forward" 			cmdno="52"/>
    <command cmdref="cmd_stop" 				cmdno="54"/>
    <command cmdref="cmd_channel_up" 			cmdno="32"/>
    <command cmdref="cmd_channel_down" 			cmdno="33"/>
    <command cmdref="cmd_record_toggle"			cmdno="55"/>
    <command cmdref="cmd_info" 				cmdno="15"/>
    <command cmdref="cmd_smart_picture" 		cmdno="70"/>
    <command cmdref="cmd_ok" 				cmdno="87"/>
    <command cmdref="cmd_skip_search" 			cmdno="106"/>
    <command cmdref="cmd_rec_end_search" 		cmdno="117"/>
    <command cmdref="cmd_menu" 				cmdno="82"/>
    <command cmdref="cmd_timer" 			cmdno="69"/>
    <command cmdref="cmd_turbo_timer" 			cmdno="28"/>
    <command cmdref="cmd_lp_sp" 			cmdno="58"/>
    <command cmdref="cmd_I_II" 				cmdno="35"/>
    <command cmdref="cmd_standby" 			cmdno="6"/>

    <!-- power_on = standby + power_toggle -->
    <!-- power_off = standby + standby -->
  </commandset>
</device>
