<?xml version="1.0" encoding="UTF-8"?>
<!DOCTYPE device PUBLIC "-//bengt-martensson.de//devices//en"
 "../dtds/devices.dtd">
<device id="philips_28ml8805" name="Philips TV 28ML8805" vendor="Philips" model="28ML8805" type="tv">
  <jp1data>
    <setupcode value="1234"/>
  </jp1data>
  <commandset type="ir" protocol="rc5" toggle="yes" deviceno="0"
    remotename="philips_28ml8805">
    <command cmdref="cmd_0" 				cmdno="0"/>
    <command cmdref="cmd_1" 				cmdno="1"/>
    <command cmdref="cmd_2" 				cmdno="2"/>
    <command cmdref="cmd_3" 				cmdno="3"/>
    <command cmdref="cmd_4" 				cmdno="4"/>
    <command cmdref="cmd_5" 				cmdno="5"/>
    <command cmdref="cmd_6" 				cmdno="6"/>
    <command cmdref="cmd_7" 				cmdno="7"/>
    <command cmdref="cmd_8" 				cmdno="8"/>
    <command cmdref="cmd_9" 				cmdno="9"/>
    <command cmdref="cmd_power_off" name="power"	cmdno="12"/>
    <command cmdref="cmd_tv_mode"			cmdno="63"/>
    <command cmdref="cmd_channel_up" 			cmdno="32"/>
    <command cmdref="cmd_channel_down" 			cmdno="33"/>
    <command cmdref="cmd_mute_toggle" name="mute"	cmdno="13"/>
    <command cmdref="cmd_last_channel" 			cmdno="34"/>
    <command cmdref="cmd_volume_up" 			cmdno="16"/>
    <command cmdref="cmd_volume_down" 			cmdno="17"/>
    <command cmdref="cmd_PP" 				cmdno="14"/>
    <command cmdref="cmd_info" 				cmdno="15"/>
    <command cmdref="cmd_brightness_down" 		cmdno="19"/>
    <command cmdref="cmd_brightness_up" 		cmdno="18"/>
    <command cmdref="cmd_aspectratio"	 		cmdno="126"/>
    <command cmdref="cmd_menu" 				cmdno="82"/>
    <command cmdref="cmd_up" 				cmdno="80"/>
    <command cmdref="cmd_down" 				cmdno="81"/>
    <command cmdref="cmd_red" 				cmdno="107"/>
    <command cmdref="cmd_green" 			cmdno="108"/>
    <command cmdref="cmd_yellow" 			cmdno="109"/>
    <command cmdref="cmd_blue" 				cmdno="110"/>
    <command cmdref="cmd_white" 			cmdno="111"/>
    <command cmdref="cmd_menu_off" 			cmdno="83"/>
    <command cmdref="cmd_I_II" 				cmdno="35"/>
    <command cmdref="cmd_teletext" 			cmdno="60"/>
    <command cmdref="cmd_teletext_freeze" 		cmdno="41"/>
    <command cmdref="cmd_teletext_reveal" 		cmdno="44"/>
    <command cmdref="cmd_teletext_hide" 		cmdno="45"/>
    <command cmdref="cmd_teletext_translucent" 		cmdno="46"/>
    <command cmdref="cmd_teletext_doubleheight" 	cmdno="43"/>
    <command cmdref="cmd_teletext_time" 		cmdno="42"/>
    <command cmdref="cmd_PIP" 				cmdno="88"/>
    <command cmdref="cmd_PIP_source" 			cmdno="95"/>
    <command cmdref="cmd_PIP_exchange" 			cmdno="90"/>
    <command cmdref="cmd_PIP_freeze" 			cmdno="101"/>
    <command cmdref="cmd_PIP_position" 			cmdno="89"/>
    <command cmdref="cmd_PIP_ch_down" 			cmdno="103"/>
    <command cmdref="cmd_PIP_ch_up" 			cmdno="102"/>
    <command cmdref="cmd_freeze_toggle"			cmdno="93"/>
    <command cmdref="cmd_DNR" 				cmdno="97"/>
    <command cmdref="cmd_special" 			cmdno="94"/>
  </commandset>

  <commandset type="ir" protocol="rc5" toggle="yes" deviceno="12"
    remotename="philips_28ml8805" pseudo_power_on="cmd_in_aux">
    <command cmdref="cmd_in_aux"		 	cmdno="63"/>
  </commandset>
  <commandset type="ir" protocol="rc5" toggle="yes" deviceno="5" remotename="philips_28ml8805">
    <command cmdref="cmd_in_vcr"			cmdno="63"/>
  </commandset>
</device>
